,number,values_0,values_1,datetime_start,datetime_complete,duration,params_epochs,params_init_weights,params_log batch size,params_lr,params_weight_decay,system_attrs_nsga2:generation,state
0,0,0.5344920425966848,1.0,2023-10-06 11:44:20.625931,2023-10-06 11:53:36.400761,0 days 00:09:15.774830,25,xavier,5,0.00012019647518985578,0.00010356723470225415,0,COMPLETE
1,1,0.4240707626832383,0.9433333333333334,2023-10-06 11:53:36.403281,2023-10-06 12:00:20.556446,0 days 00:06:44.153165,20,xavier,4,2.2794803242415194e-05,0.00029052171107832287,0,COMPLETE
2,2,0.43791438080370426,0.9166666666666666,2023-10-06 12:00:20.559275,2023-10-06 12:09:05.550462,0 days 00:08:44.991187,25,xavier,4,1.8062954146895256e-05,0.0007702904845186655,0,COMPLETE
3,3,1.7883716715596065,0.8759881825282593,2023-10-06 12:09:05.553347,2023-10-06 12:26:02.427652,0 days 00:16:56.874305,45,xavier,1,0.0006665407425725342,0.008817314531997914,0,COMPLETE
4,4,1.1226633875075744,1.0,2023-10-06 12:26:02.430651,2023-10-06 12:31:00.929706,0 days 00:04:58.499055,15,xavier,4,0.0005586288900453707,0.0008553478789170129,0,COMPLETE
5,5,0.4081978874268576,0.9833333333333332,2023-10-06 12:31:00.932453,2023-10-06 12:36:04.762868,0 days 00:05:03.830415,15,kaiming,4,0.0001344982677582207,0.009272414151541246,0,COMPLETE
6,6,2.984744057962911,0.7500516273624072,2023-10-06 12:36:04.765711,2023-10-06 12:59:00.891669,0 days 00:22:56.125958,55,xavier,0,0.0008176717212764677,0.00019152921275941793,0,COMPLETE
7,7,0.6202395275235176,0.7905555555555555,2023-10-06 12:59:00.895461,2023-10-06 13:00:42.118622,0 days 00:01:41.223161,5,kaiming,3,1.8192749194383033e-05,0.008038694782417857,0,COMPLETE
8,8,0.3616717515646347,0.9666666666666668,2023-10-06 13:00:42.121646,2023-10-06 13:05:37.910451,0 days 00:04:55.788805,15,xavier,4,0.00011310156039601254,0.00014403396089665815,0,COMPLETE
9,9,0.9035776647987014,0.9584183673469389,2023-10-06 13:05:37.913364,2023-10-06 13:13:49.984772,0 days 00:08:12.071408,25,xavier,3,0.0004274257705930643,0.002224861797589601,0,COMPLETE
10,10,0.4345919209149997,0.971130690038253,2023-10-06 13:13:49.988094,2023-10-06 13:17:06.923575,0 days 00:03:16.935481,10,xavier,2,0.00018046981022387727,0.0001195597551431321,0,COMPLETE
11,11,0.3898651477459615,0.9623607397504456,2023-10-06 13:17:06.926033,2023-10-06 13:33:02.167184,0 days 00:15:55.241151,45,xavier,2,3.191250097479961e-05,0.0010174680908546013,0,COMPLETE
12,12,0.976437662211587,0.9440540800531748,2023-10-06 13:33:02.170555,2023-10-06 13:45:20.637148,0 days 00:12:18.466593,30,kaiming,0,0.0003579003774413361,0.00031897587438330707,0,COMPLETE
13,13,0.26643714463072166,0.9666666666666666,2023-10-06 13:45:20.639431,2023-10-06 13:55:30.400483,0 days 00:10:09.761052,30,xavier,4,3.260153159061411e-05,0.0007375809356100737,0,COMPLETE
14,14,0.39773200069155007,0.9333333333333332,2023-10-06 13:55:30.402801,2023-10-06 14:00:32.329485,0 days 00:05:01.926684,15,xavier,4,4.9813828469837274e-05,0.003093229392466959,0,COMPLETE
15,15,0.3919036238541594,0.9,2023-10-06 14:00:32.332556,2023-10-06 14:24:35.213628,0 days 00:24:02.881072,60,xavier,5,5.289704105785769e-05,0.0002511685062547442,0,COMPLETE
16,16,0.694411551952362,0.55,2023-10-06 14:24:35.217095,2023-10-06 14:26:57.118339,0 days 00:02:21.901244,5,kaiming,5,9.754011332470688e-05,0.0008527979625235084,0,COMPLETE
17,17,1.998320883568996,0.8709317349872071,2023-10-06 14:26:57.121994,2023-10-06 14:31:41.635090,0 days 00:04:44.513096,10,kaiming,1,0.0008028947109499315,0.0006181678544253831,0,COMPLETE
18,18,0.5664946942457131,0.9833333333333332,2023-10-06 14:31:41.638716,2023-10-06 14:34:02.769740,0 days 00:02:21.131024,5,xavier,4,0.0001242061204493064,0.001229092766336332,0,COMPLETE
19,19,0.7856094404550957,0.9560265630521594,2023-10-06 14:34:02.773999,2023-10-06 14:53:06.510661,0 days 00:19:03.736662,35,xavier,0,3.782244352160569e-05,0.0002592147754584496,0,COMPLETE
20,20,0.27820127454164584,0.9763186813186813,2023-10-06 14:53:06.515259,2023-10-06 15:05:21.794723,0 days 00:12:15.279464,25,xavier,2,4.245307275364723e-05,0.0054293212229231105,0,COMPLETE
21,21,2.203631015054559,0.8266380459729593,2023-10-06 15:05:21.799467,2023-10-06 15:21:35.949071,0 days 00:16:14.149604,30,kaiming,0,0.0008738922816395297,0.000648041182053703,0,COMPLETE
22,22,0.40765707528717676,0.9627721648111454,2023-10-06 15:21:35.952094,2023-10-06 15:26:43.065848,0 days 00:05:07.113754,10,kaiming,1,7.72506736006727e-05,0.00015836679033272012,0,COMPLETE
23,23,0.45547794985541906,0.9731459314495028,2023-10-06 15:26:43.069642,2023-10-06 15:38:26.232787,0 days 00:11:43.163145,25,xavier,2,0.000241020050524981,0.0038027678194960963,0,COMPLETE
24,24,0.3408790734197412,1.0,2023-10-06 15:38:26.237393,2023-10-06 15:42:58.716891,0 days 00:04:32.479498,10,xavier,4,0.00014338158524338532,0.0007262178346359084,0,COMPLETE
25,25,1.214369457289422,0.9,2023-10-06 15:42:58.720420,2023-10-06 16:08:08.500877,0 days 00:25:09.780457,50,kaiming,5,0.0002010123942549284,0.0032104863032045607,0,COMPLETE
26,26,0.6084781415760517,0.55,2023-10-06 16:08:08.504597,2023-10-06 16:12:55.178800,0 days 00:04:46.674203,10,kaiming,5,5.104926345125425e-05,0.00022988300652489072,0,COMPLETE
27,27,0.8867930585923508,0.9520661095302214,2023-10-06 16:12:55.181336,2023-10-06 16:42:27.678702,0 days 00:29:32.497366,55,kaiming,0,0.00021672776350178596,0.008270031325740008,0,COMPLETE
28,28,0.8550414021979511,0.9247222222222222,2023-10-06 16:42:27.682097,2023-10-06 17:02:21.923537,0 days 00:19:54.241440,45,xavier,3,0.000828325453658416,0.009159327345948097,0,COMPLETE
29,29,0.5824098567132834,0.9685083939738723,2023-10-06 17:02:21.926987,2023-10-06 17:24:09.974942,0 days 00:21:48.047955,40,kaiming,0,0.00017725785989506677,0.00025916961758553324,0,COMPLETE
30,30,0.3793111032676149,0.932020202020202,2023-10-06 17:24:09.978692,2023-10-06 17:42:00.280192,0 days 00:17:50.301500,40,xavier,3,4.655492775461816e-05,0.007011331130169854,0,COMPLETE
31,31,0.3873401315417141,0.9,2023-10-06 17:42:00.284123,2023-10-06 17:49:08.202888,0 days 00:07:07.918765,15,kaiming,5,0.00013845983798001528,0.00032734214272286017,0,COMPLETE
32,32,0.5060869646923882,0.9125,2023-10-06 17:49:08.205928,2023-10-06 17:53:03.249663,0 days 00:03:55.043735,10,xavier,3,1.0803577887247808e-05,0.0006608998403660424,0,COMPLETE
33,33,0.3262333065535672,0.9673468333989336,2023-10-06 17:53:03.252337,2023-10-06 18:03:34.812179,0 days 00:10:31.559842,20,kaiming,0,1.548754355235324e-05,0.009450896258978533,0,COMPLETE
34,34,0.6124850672319577,0.9632081727177887,2023-10-06 18:03:34.819319,2023-10-06 18:31:08.174772,0 days 00:27:33.355453,50,kaiming,0,6.0154819640465526e-05,0.0006308405689409434,0,COMPLETE
35,35,0.8671112018910273,0.9416764584621727,2023-10-06 18:31:08.182910,2023-10-06 18:55:56.572802,0 days 00:24:48.389892,55,xavier,2,7.833138139459952e-05,0.00017513486483968006,0,COMPLETE
36,36,0.287878185881313,0.9708361448493028,2023-10-06 18:55:56.575960,2023-10-06 19:14:48.708679,0 days 00:18:52.132719,40,xavier,2,2.7053884969160524e-05,0.0005684649527006181,0,COMPLETE
37,37,0.18810572397269426,0.9333333333333332,2023-10-06 19:14:48.713516,2023-10-06 19:29:57.608438,0 days 00:15:08.894922,30,xavier,5,0.0001992823160576297,0.000981183883702343,0,COMPLETE
38,38,1.3319718682925212,0.9,2023-10-06 19:29:57.612460,2023-10-06 19:48:49.515596,0 days 00:18:51.903136,40,xavier,5,0.0006679927023537489,0.0006314040090021488,0,COMPLETE
39,39,0.11037276395044111,1.0,2023-10-06 19:48:49.519913,2023-10-06 20:08:10.043794,0 days 00:19:20.523881,45,kaiming,4,7.560093368698361e-05,0.00023206545376535737,0,COMPLETE
40,40,0.8273542493329062,0.9469387755102041,2023-10-06 20:08:10.047242,2023-10-06 20:28:29.273316,0 days 00:20:19.226074,50,xavier,3,0.0003244659787125011,0.003324062647542373,0,COMPLETE
41,41,0.49632865376770496,0.8333333333333333,2023-10-06 20:28:29.282138,2023-10-06 20:36:21.071342,0 days 00:07:51.789204,15,xavier,5,5.368290757768734e-05,0.00033193425645796287,0,COMPLETE
42,42,0.4076137187236002,0.9542517006802722,2023-10-06 20:36:21.074835,2023-10-06 21:03:17.904366,0 days 00:26:56.829531,60,xavier,3,1.5446233915572642e-05,0.009335355692667188,0,COMPLETE
43,43,0.28268798645294735,1.0,2023-10-06 21:03:17.907913,2023-10-06 21:30:59.004441,0 days 00:27:41.096528,55,xavier,5,9.063138050285509e-05,0.0005710240247560019,0,COMPLETE
44,44,2.1635825966754445,0.8593163254755997,2023-10-06 21:30:59.008229,2023-10-06 21:41:33.609433,0 days 00:10:34.601204,20,kaiming,1,0.0009378052162435547,0.00013752581483632666,0,COMPLETE
45,45,0.4037046176999161,0.9833224420657484,2023-10-06 21:41:33.613025,2023-10-06 22:14:08.785858,0 days 00:32:35.172833,55,kaiming,0,0.00014197952894443193,0.001241453522693912,0,COMPLETE
46,46,0.3112034130006708,0.9586734693877551,2023-10-06 22:14:08.792145,2023-10-06 22:24:49.863324,0 days 00:10:41.071179,25,kaiming,3,3.4669869912042604e-05,0.007619689051634363,0,COMPLETE
47,47,0.6408263712496721,0.9786454830083017,2023-10-06 22:24:49.866574,2023-10-06 22:52:14.612858,0 days 00:27:24.746284,60,xavier,1,9.38160093683215e-05,0.0004955487591479441,0,COMPLETE
48,48,0.26049615156423117,0.9693367346938775,2023-10-06 22:52:14.617058,2023-10-06 23:00:30.410795,0 days 00:08:15.793737,20,xavier,3,3.0474754840218986e-05,0.0008952011404705588,0,COMPLETE
49,49,0.6872250240725797,0.9708788060678817,2023-10-06 23:00:30.413652,2023-10-06 23:26:58.883161,0 days 00:26:28.469509,60,xavier,2,0.00046674745886043597,0.003229868939754273,0,COMPLETE
50,50,0.37583570881214917,0.9722596153846155,2023-10-06 23:26:58.886336,2023-10-06 23:33:55.930171,0 days 00:06:57.043835,15,xavier,2,0.0001242061204493064,0.001229092766336332,1,COMPLETE
51,51,0.6362761952578587,0.9641641910887543,2023-10-06 23:33:55.940504,2023-10-06 23:36:41.162883,0 days 00:02:45.222379,5,kaiming,0,0.00014197952894443193,0.001241453522693912,1,COMPLETE
52,52,0.289921649871394,0.9,2023-10-06 23:36:41.168131,2023-10-06 23:55:09.942797,0 days 00:18:28.774666,40,xavier,5,5.368290757768734e-05,0.00033193425645796287,1,COMPLETE
53,53,0.5114419932149119,0.9729869281271288,2023-10-06 23:55:09.946336,2023-10-07 00:08:33.679965,0 days 00:13:23.733629,30,xavier,0,6.0154819640465526e-05,0.0006308405689409434,1,COMPLETE
54,54,0.41368438527195917,0.9833333333333332,2023-10-07 00:08:33.684379,2023-10-07 00:15:21.231463,0 days 00:06:47.547084,15,xavier,4,0.00014338158524338532,0.0007262178346359084,1,COMPLETE
55,55,0.5656030683899254,0.9823656455589228,2023-10-07 00:15:21.235467,2023-10-07 00:29:28.431469,0 days 00:14:07.196002,30,kaiming,2,0.0001992823160576297,0.000981183883702343,1,COMPLETE
56,56,0.7186012136483442,0.85,2023-10-07 00:29:28.436023,2023-10-07 00:56:47.230778,0 days 00:27:18.794755,60,xavier,5,0.0001992823160576297,0.000981183883702343,1,COMPLETE
57,57,0.4345919209149997,0.971130690038253,2023-10-07 00:56:47.238887,2023-10-07 01:01:50.366380,0 days 00:05:03.127493,10,xavier,2,0.00018046981022387727,0.0001195597551431321,1,COMPLETE
58,58,0.3353275736860398,1.0,2023-10-07 01:01:50.369803,2023-10-07 01:06:47.598975,0 days 00:04:57.229172,10,xavier,4,0.00014338158524338532,0.0067921480427399865,1,COMPLETE
59,59,0.354022096987189,0.9689591226626831,2023-10-07 01:06:47.601827,2023-10-07 01:28:37.184172,0 days 00:21:49.582345,40,kaiming,2,2.7053884969160524e-05,0.000981183883702343,1,COMPLETE
60,60,0.5609735413771497,1.0,2023-10-07 01:28:37.187489,2023-10-07 01:59:09.716959,0 days 00:30:32.529470,60,kaiming,4,0.0001344982677582207,0.009272414151541246,1,COMPLETE
61,61,0.26784507971199545,0.9834988226059653,2023-10-07 01:59:09.720228,2023-10-07 02:18:45.000353,0 days 00:19:35.280125,25,xavier,2,2.7053884969160524e-05,0.004763755525421821,1,COMPLETE
62,62,0.0952357545974207,1.0,2023-10-07 02:18:45.004976,2023-10-07 02:51:06.157871,0 days 00:32:21.152895,55,xavier,4,0.00014338158524338532,0.001241453522693912,1,COMPLETE
63,63,0.4606739751099437,0.9626424984741797,2023-10-07 02:51:06.164693,2023-10-07 03:09:36.849759,0 days 00:18:30.685066,25,xavier,0,1.7754924402869687e-05,0.00025916961758553324,1,COMPLETE
64,64,0.3902550238772943,0.9466666666666667,2023-10-07 03:09:36.855211,2023-10-07 03:43:43.736838,0 days 00:34:06.881627,60,xavier,4,5.289704105785769e-05,0.0002511685062547442,1,COMPLETE
65,65,0.5344920425966848,1.0,2023-10-07 03:43:43.739885,2023-10-07 03:56:38.849819,0 days 00:12:55.109934,25,xavier,5,0.00012019647518985578,0.00010356723470225415,1,COMPLETE
66,66,0.20828659331985233,1.0,2023-10-07 03:56:38.853259,2023-10-07 04:16:48.618577,0 days 00:20:09.765318,40,kaiming,4,7.560093368698361e-05,0.0005684649527006181,1,COMPLETE
67,67,0.37731429192042143,0.9666666666666668,2023-10-07 04:16:48.622197,2023-10-07 04:24:07.748659,0 days 00:07:19.126462,15,xavier,4,0.00012019647518985578,0.009272414151541246,1,COMPLETE
68,68,0.7005836887294988,1.0,2023-10-07 04:24:07.752370,2023-10-07 04:29:30.211349,0 days 00:05:22.458979,10,xavier,4,0.0003310167891636679,0.003093229392466959,1,COMPLETE
69,69,0.4793985384214726,0.9501700680272108,2023-10-07 04:29:30.214924,2023-10-07 04:59:51.143812,0 days 00:30:20.928888,60,xavier,3,3.0474754840218986e-05,0.0008952011404705588,1,COMPLETE
70,70,0.6155479333690825,0.9757802663834099,2023-10-07 04:59:51.147187,2023-10-07 05:25:29.757792,0 days 00:25:38.610605,45,kaiming,0,7.560093368698361e-05,0.00023206545376535737,1,COMPLETE
71,71,0.48710557105109087,0.981695348593983,2023-10-07 05:25:29.762036,2023-10-07 05:55:21.069909,0 days 00:29:51.307873,60,xavier,2,0.00018046981022387727,0.0001195597551431321,1,COMPLETE
72,72,0.3754038140177727,1.0,2023-10-07 05:55:21.072989,2023-10-07 06:18:03.119506,0 days 00:22:42.046517,45,kaiming,5,1.548754355235324e-05,0.00802844819427594,1,COMPLETE
73,73,0.4799767002618971,0.9784969799178441,2023-10-07 06:18:03.123482,2023-10-07 06:49:53.575541,0 days 00:31:50.452059,55,xavier,0,9.063138050285509e-05,0.0002592147754584496,1,COMPLETE
74,74,0.13582169323235577,1.0,2023-10-07 06:49:53.580388,2023-10-07 07:13:04.883264,0 days 00:23:11.302876,45,xavier,5,0.00012019647518985578,0.0005050096218135698,1,COMPLETE
75,75,0.4010844160669616,0.9333333333333332,2023-10-07 07:13:04.887225,2023-10-07 07:20:21.992126,0 days 00:07:17.104901,15,kaiming,4,4.9813828469837274e-05,0.00023206545376535737,1,COMPLETE
76,76,0.4305846721898498,0.8953401360544218,2023-10-07 07:20:21.995968,2023-10-07 07:30:04.778263,0 days 00:09:42.782295,20,xavier,3,1.328023650032542e-05,0.0008952011404705588,1,COMPLETE
77,77,0.5242721776108218,0.909740775097918,2023-10-07 07:30:04.781520,2023-10-07 07:49:52.451673,0 days 00:19:47.670153,40,kaiming,3,2.7053884969160524e-05,0.0005684649527006181,1,COMPLETE
78,78,1.0228054965689548,0.9833333333333332,2023-10-07 07:49:52.455370,2023-10-07 08:19:01.301176,0 days 00:29:08.845806,60,xavier,4,0.00036870325984683715,0.004126051060981465,1,COMPLETE
79,79,0.37565995622962467,0.975162120686394,2023-10-07 08:19:01.304067,2023-10-07 08:24:40.921253,0 days 00:05:39.617186,10,kaiming,0,7.72506736006727e-05,0.00017513486483968006,1,COMPLETE
80,80,0.3052450410767051,0.9586734693877551,2023-10-07 08:24:40.924462,2023-10-07 08:36:41.747595,0 days 00:12:00.823133,25,xavier,3,3.4669869912042604e-05,0.00015836679033272012,1,COMPLETE
81,81,0.5616708290631183,0.970498377880736,2023-10-07 08:36:41.751285,2023-10-07 08:59:26.195825,0 days 00:22:44.444540,40,xavier,0,0.00017725785989506677,0.0005684649527006181,1,COMPLETE
82,82,0.2751059213020329,0.981452773417059,2023-10-07 08:59:26.199454,2023-10-07 09:11:51.021411,0 days 00:12:24.821957,25,xavier,2,2.7053884969160524e-05,0.0005684649527006181,1,COMPLETE
83,83,0.49648039396852256,0.8333333333333333,2023-10-07 09:11:51.025182,2023-10-07 09:19:24.665667,0 days 00:07:33.640485,15,xavier,5,5.368290757768734e-05,0.003324062647542373,1,COMPLETE
84,84,1.3990271823182412,0.9333333333333333,2023-10-07 09:19:24.669501,2023-10-07 09:21:47.344981,0 days 00:02:22.675480,5,xavier,4,0.0007735692086040079,0.00015836679033272012,1,COMPLETE
85,85,0.5138379466320788,0.885,2023-10-07 09:21:47.349303,2023-10-07 09:24:13.324135,0 days 00:02:25.974832,5,xavier,3,3.260153159061411e-05,0.007619689051634363,1,COMPLETE
86,86,0.32262127713394356,0.9484615384615385,2023-10-07 09:24:13.327662,2023-10-07 09:31:47.826472,0 days 00:07:34.498810,15,kaiming,2,3.260153159061411e-05,0.0007375809356100737,1,COMPLETE
87,87,0.4177608643624288,0.9711745677291896,2023-10-07 09:31:47.831159,2023-10-07 09:36:46.699819,0 days 00:04:58.868660,10,xavier,2,0.00018046981022387727,0.0007262178346359084,1,COMPLETE
88,88,1.0508218341748488,0.95,2023-10-07 09:36:46.703137,2023-10-07 09:44:14.050909,0 days 00:07:27.347772,15,xavier,5,0.0005586288900453707,0.0008553478789170129,1,COMPLETE
89,89,0.6599839493901593,0.971129492796204,2023-10-07 09:44:14.054625,2023-10-07 09:50:33.438771,0 days 00:06:19.384146,10,xavier,0,0.00017341516900780667,0.00022988300652489072,1,COMPLETE
90,90,0.4098813784714041,0.9416281757458227,2023-10-07 09:50:33.441751,2023-10-07 10:06:36.507513,0 days 00:16:03.065762,30,xavier,2,1.05705390447983e-05,0.007585064369176209,1,COMPLETE
91,91,0.27820127454164584,0.9763186813186813,2023-10-07 10:06:36.510545,2023-10-07 10:18:56.325887,0 days 00:12:19.815342,25,xavier,2,4.245307275364723e-05,0.0054293212229231105,1,COMPLETE
92,92,0.18814105454366653,1.0,2023-10-07 10:18:56.329759,2023-10-07 10:41:51.366649,0 days 00:22:55.036890,45,xavier,5,5.289704105785769e-05,0.00021254029791224356,1,COMPLETE
93,93,0.4579917612117924,0.9645366943567844,2023-10-07 10:41:51.371809,2023-10-07 10:47:31.994599,0 days 00:05:40.622790,10,kaiming,1,9.063138050285509e-05,0.00015836679033272012,1,COMPLETE
94,94,0.39236810708410175,1.0,2023-10-07 10:47:31.997810,2023-10-07 10:56:07.364443,0 days 00:08:35.366633,15,xavier,4,0.0001344982677582207,0.009272414151541246,1,COMPLETE
95,95,0.2830916755076032,1.0,2023-10-07 10:56:07.367501,2023-10-07 11:39:06.641464,0 days 00:42:59.273963,55,xavier,5,9.063138050285509e-05,0.0004955487591479441,1,COMPLETE
96,96,0.4128152705729008,1.0,2023-10-07 11:39:06.644879,2023-10-07 12:13:04.168497,0 days 00:33:57.523618,45,xavier,5,1.0546349240435259e-05,0.00017695647390878462,1,COMPLETE
97,97,0.42162991841454256,0.9740809785452642,2023-10-07 12:13:04.172257,2023-10-07 12:33:06.749205,0 days 00:20:02.576948,25,xavier,2,0.000241020050524981,0.0005570858592385623,1,COMPLETE
98,98,0.1780695344600904,0.9911111111111112,2023-10-07 12:33:06.753606,2023-10-07 12:53:21.851686,0 days 00:20:15.098080,45,kaiming,3,7.560093368698361e-05,0.00023206545376535737,1,COMPLETE
99,99,0.6943697720766068,0.55,2023-10-07 12:53:21.856304,2023-10-07 12:55:43.888610,0 days 00:02:22.032306,5,kaiming,5,9.754011332470688e-05,0.00020734447549472233,1,COMPLETE
