,number,values_0,values_1,datetime_start,datetime_complete,duration,params_epochs,params_init_weights,params_log batch size,params_lr,params_weight_decay,system_attrs_nsga2:generation,state
0,0,1.4074683307902887,0.6333333333333333,2023-10-04 12:31:32.189248,2023-10-04 12:57:22.916009,0 days 00:25:50.726761,50,xavier,5,7.756983343103515e-05,0.0017055418029547835,0,COMPLETE
1,1,2.185670520881083,0.5094343156843157,2023-10-04 12:57:22.918504,2023-10-04 13:18:40.026636,0 days 00:21:17.108132,45,xavier,2,8.025117130139581e-05,0.002498901558834595,0,COMPLETE
2,2,0.6603630010504276,0.65,2023-10-04 13:18:40.030119,2023-10-04 13:43:47.199672,0 days 00:25:07.169553,55,kaiming,5,2.9031746159753427e-05,0.002796710275477125,0,COMPLETE
3,3,4.2940890116539325,0.7166666666666667,2023-10-04 13:43:47.207563,2023-10-04 14:03:41.127435,0 days 00:19:53.919872,45,kaiming,5,0.0003078905904798025,0.006496522367380929,0,COMPLETE
4,4,0.9247137667877332,0.4800000000000001,2023-10-04 14:03:41.131827,2023-10-04 14:20:32.569633,0 days 00:16:51.437806,35,kaiming,4,2.9987012829741616e-05,0.00034081964885732173,0,COMPLETE
5,5,6.907351970692616,0.55,2023-10-04 14:20:32.572347,2023-10-04 15:01:23.346642,0 days 00:40:50.774295,55,kaiming,5,0.0005618628079159029,0.001628931112865895,0,COMPLETE
6,6,1.1276576418429614,0.7,2023-10-04 15:01:23.467492,2023-10-04 15:18:46.417599,0 days 00:17:22.950107,30,kaiming,5,2.3908207388030162e-05,0.0005309161885858447,0,COMPLETE
7,7,0.9575226717761586,0.4777267573696145,2023-10-04 15:18:46.420770,2023-10-04 15:30:55.645957,0 days 00:12:09.225187,20,xavier,3,2.4925198299231286e-05,0.00031548643574718873,0,COMPLETE
8,8,0.9229696169495583,0.5833333333333333,2023-10-04 15:30:55.648439,2023-10-04 15:48:55.864200,0 days 00:18:00.215761,25,kaiming,5,1.1742386920351268e-05,0.00012605882254308583,0,COMPLETE
9,9,0.6464105543281351,0.6812528344671203,2023-10-04 15:48:55.869595,2023-10-04 15:58:03.404226,0 days 00:09:07.534631,20,kaiming,3,1.160792132534292e-05,0.0023147972321540533,0,COMPLETE
10,10,2.700652394420376,0.25,2023-10-04 15:58:03.407005,2023-10-04 16:08:03.947443,0 days 00:10:00.540438,20,xavier,5,0.00039854361953811656,0.0005159460380460043,0,COMPLETE
11,11,2.0928700436191776,0.4666666666666666,2023-10-04 16:08:03.950380,2023-10-04 16:28:09.931578,0 days 00:20:05.981198,40,kaiming,5,0.00017908195110697078,0.00034787918884659504,0,COMPLETE
12,12,5.732810580795091,0.49000000000000005,2023-10-04 16:28:09.935920,2023-10-04 16:35:03.580690,0 days 00:06:53.644770,15,xavier,4,0.0005520394925888489,0.0037679154735216513,0,COMPLETE
13,13,1.094383082676817,0.5522383145177263,2023-10-04 16:35:03.586363,2023-10-04 17:02:24.149868,0 days 00:27:20.563505,55,kaiming,2,2.467179349224917e-05,0.003955268925142164,0,COMPLETE
14,14,1.225465577781304,0.38593954248366014,2023-10-04 17:02:24.153090,2023-10-04 17:15:00.364391,0 days 00:12:36.211301,25,kaiming,2,5.490779643815036e-05,0.0009761604547455254,0,COMPLETE
15,15,0.7342763817972606,0.4970710335416218,2023-10-04 17:15:00.367330,2023-10-04 17:22:44.393422,0 days 00:07:44.026092,15,kaiming,2,1.439749256907687e-05,0.00024588196761306773,0,COMPLETE
16,16,1.3629655368557132,0.46844254510921174,2023-10-04 17:22:44.396636,2023-10-04 17:25:14.400942,0 days 00:02:30.004306,5,xavier,2,8.278590129938037e-05,0.00048511658243463097,0,COMPLETE
17,17,0.894694097340107,0.6333333333333333,2023-10-04 17:25:14.404407,2023-10-04 17:40:42.825669,0 days 00:15:28.421262,30,xavier,5,6.15419687405192e-05,0.0019194405497254584,0,COMPLETE
18,18,2.690947860414826,0.5666666666666667,2023-10-04 17:40:42.829314,2023-10-04 17:43:16.844204,0 days 00:02:34.014890,5,kaiming,5,0.0005643420122479468,0.0007392899359134408,0,COMPLETE
19,19,1.2046745361294597,0.3333333333333333,2023-10-04 17:43:16.846971,2023-10-04 17:51:10.062486,0 days 00:07:53.215515,15,kaiming,5,4.2361629268544915e-05,0.0016713669821718745,0,COMPLETE
20,20,1.0282780250212658,0.6175505050505051,2023-10-04 17:51:10.065345,2023-10-04 18:17:33.462277,0 days 00:26:23.396932,50,xavier,2,1.3759676014151267e-05,0.003151991071439625,0,COMPLETE
21,21,4.769336094204364,0.4875,2023-10-04 18:17:33.465247,2023-10-04 18:24:59.420362,0 days 00:07:25.955115,15,xavier,3,0.0005755204654760927,0.0003739035734435423,0,COMPLETE
22,22,0.8901278160788395,0.543300557467224,2023-10-04 18:24:59.424108,2023-10-04 18:37:20.941168,0 days 00:12:21.517060,20,kaiming,2,1.7165994995213587e-05,0.0030343061368623236,0,COMPLETE
23,23,1.1924218650109002,0.41666666666666663,2023-10-04 18:37:20.945100,2023-10-04 18:43:18.952959,0 days 00:05:58.007859,10,kaiming,4,5.106919329191321e-05,0.0005077695592260432,0,COMPLETE
24,24,0.92398460741554,0.5,2023-10-04 18:43:18.956100,2023-10-04 18:49:04.440203,0 days 00:05:45.484103,10,kaiming,4,1.0806277773722783e-05,0.0009807645517068144,0,COMPLETE
25,25,1.9965300589267696,0.6266666666666667,2023-10-04 18:49:04.443770,2023-10-04 19:06:57.888397,0 days 00:17:53.444627,30,kaiming,4,7.563678909592054e-05,0.003370929974199209,0,COMPLETE
26,26,5.372573061369271,0.5,2023-10-04 19:06:57.891449,2023-10-04 19:20:25.843844,0 days 00:13:27.952395,20,xavier,2,0.0005225458073791873,0.006750909760326444,0,COMPLETE
27,27,1.0102893828281334,0.3966666666666666,2023-10-04 19:20:25.849368,2023-10-04 19:48:21.242907,0 days 00:27:55.393539,45,kaiming,4,3.193693514904901e-05,0.00048296779885184725,0,COMPLETE
28,28,3.622354052657569,0.6266666666666667,2023-10-04 19:48:21.245953,2023-10-04 20:06:11.502336,0 days 00:17:50.256383,30,kaiming,4,0.00015141969357094926,0.0020564771840995816,0,COMPLETE
29,29,4.227716912271455,0.518015318015318,2023-10-04 20:06:11.505657,2023-10-04 20:11:09.238914,0 days 00:04:57.733257,10,xavier,2,0.00018999824252825717,0.000555262574539825,0,COMPLETE
30,30,4.769297320531443,0.49715909090909094,2023-10-04 20:11:09.241571,2023-10-04 20:36:48.812344,0 days 00:25:39.570773,55,xavier,3,0.00022318797367628027,0.0024939405536152904,0,COMPLETE
31,31,5.098257139778759,0.5,2023-10-04 20:36:48.815190,2023-10-04 21:04:49.630543,0 days 00:28:00.815353,60,kaiming,3,0.00024335945877135298,0.0029438243879293126,0,COMPLETE
32,32,0.7903480678796768,0.5666666666666667,2023-10-04 21:04:49.633204,2023-10-04 21:15:35.214644,0 days 00:10:45.581440,25,xavier,4,2.4754932835120276e-05,0.0003080938019287428,0,COMPLETE
33,33,2.717385365104487,0.48999999999999994,2023-10-04 21:15:35.217548,2023-10-04 21:32:56.589442,0 days 00:17:21.371894,40,kaiming,4,0.00010992437533630567,0.006786251294044068,0,COMPLETE
34,34,2.1633443085085937,0.5499999999999999,2023-10-04 21:32:56.593922,2023-10-04 21:46:05.326497,0 days 00:13:08.732575,30,xavier,4,0.0002472513665668183,0.0002380811832552451,0,COMPLETE
35,35,1.3963954277685844,0.5,2023-10-04 21:46:05.329170,2023-10-04 22:07:56.922391,0 days 00:21:51.593221,45,kaiming,5,8.62253171693055e-05,0.00013725342542279201,0,COMPLETE
36,36,0.5748293817043304,0.7,2023-10-04 22:07:56.925720,2023-10-04 22:22:42.867952,0 days 00:14:45.942232,30,xavier,5,1.1935401995024835e-05,0.00036416936499233997,0,COMPLETE
37,37,1.2823972479307224,0.4133333333333333,2023-10-04 22:22:42.870819,2023-10-04 22:44:16.973089,0 days 00:21:34.102270,50,xavier,4,3.5027997512900245e-05,0.0006215810086304727,0,COMPLETE
38,38,2.0309624874630203,0.5080884828678947,2023-10-04 22:44:16.975767,2023-10-04 23:09:34.363302,0 days 00:25:17.387535,55,xavier,2,4.887138695816922e-05,0.0005727605686497398,0,COMPLETE
39,39,4.0834558518193775,0.5052075702075702,2023-10-04 23:09:34.366593,2023-10-04 23:27:59.873581,0 days 00:18:25.506988,40,kaiming,2,0.00010059254213327516,0.0005528757168425545,0,COMPLETE
40,40,1.5561517770402133,0.6166666666666666,2023-10-04 23:27:59.877230,2023-10-04 23:55:19.423153,0 days 00:27:19.545923,60,xavier,5,5.6386574571688674e-05,0.0007921782749878397,0,COMPLETE
41,41,3.0979281148624067,0.29999999999999993,2023-10-04 23:55:19.426109,2023-10-05 00:17:26.967102,0 days 00:22:07.540993,50,kaiming,5,0.000171512819560701,0.0005690522489778454,0,COMPLETE
42,42,1.1830460057421415,0.516965811965812,2023-10-05 00:17:26.969316,2023-10-05 00:34:52.669945,0 days 00:17:25.700629,40,kaiming,2,2.7363932521931824e-05,0.003063467287903117,0,COMPLETE
43,43,1.5624728308904365,0.5841136933242197,2023-10-05 00:34:52.672931,2023-10-05 01:00:57.283766,0 days 00:26:04.610835,60,kaiming,2,3.32099174032435e-05,0.001078098404494367,0,COMPLETE
44,44,0.8155157774686813,0.21666666666666665,2023-10-05 01:00:57.289145,2023-10-05 01:07:17.164487,0 days 00:06:19.875342,15,xavier,5,1.4757891457099025e-05,0.003385092252430027,0,COMPLETE
45,45,0.7496519160590001,0.6344387755102041,2023-10-05 01:07:17.171766,2023-10-05 01:14:32.777126,0 days 00:07:15.605360,20,xavier,3,1.3840372924128387e-05,0.0002436535934717878,0,COMPLETE
46,46,4.4352190806919225,0.3833333333333333,2023-10-05 01:14:32.779775,2023-10-05 01:33:37.453227,0 days 00:19:04.673452,45,xavier,5,0.000248874384433753,0.0021889252962985603,0,COMPLETE
47,47,5.653532171274401,0.5094047619047619,2023-10-05 01:33:37.455657,2023-10-05 01:41:25.661655,0 days 00:07:48.205998,20,kaiming,3,0.0003342944801380899,0.0028625480948500513,0,COMPLETE
48,48,1.886323358733398,0.5333333333333333,2023-10-05 01:41:25.664183,2023-10-05 01:58:18.963465,0 days 00:16:53.299282,40,xavier,5,0.00018596605454214673,0.001671006174957121,0,COMPLETE
49,49,0.8268696546933993,0.5727998236331568,2023-10-05 01:58:18.967638,2023-10-05 02:06:34.897724,0 days 00:08:15.930086,20,xavier,2,1.2877790433575135e-05,0.0015401474318360504,0,COMPLETE
50,50,0.8324141229901996,0.5666666666666667,2023-10-05 02:06:34.900995,2023-10-05 02:29:37.932395,0 days 00:23:03.031400,60,kaiming,4,2.9987012829741616e-05,0.00021202173104437007,1,COMPLETE
51,51,3.6819839959871126,0.4133333333333334,2023-10-05 02:29:37.935290,2023-10-05 02:39:29.630361,0 days 00:09:51.695071,25,xavier,4,0.0003540328172173084,0.001628931112865895,1,COMPLETE
52,52,1.4062479632241387,0.41000000000000003,2023-10-05 02:39:29.635339,2023-10-05 02:47:19.043523,0 days 00:07:49.408184,20,kaiming,4,6.434487915103275e-05,0.006750909760326444,1,COMPLETE
53,53,1.2817477470263838,0.5,2023-10-05 02:47:19.045763,2023-10-05 02:51:38.604789,0 days 00:04:19.559026,10,xavier,5,0.00018596605454214673,0.0001502101708284709,1,COMPLETE
54,54,4.029326748880476,0.5333333333333333,2023-10-05 02:51:38.608634,2023-10-05 03:14:01.746703,0 days 00:22:23.138069,50,kaiming,5,0.0005643420122479468,0.0007392899359134408,1,COMPLETE
55,55,2.1376484547614787,0.5574420024420025,2023-10-05 03:14:01.750479,2023-10-05 03:21:03.758439,0 days 00:07:02.007960,15,kaiming,2,9.14840848404229e-05,0.00024588196761306773,1,COMPLETE
56,56,0.70315772895036,0.6193181818181819,2023-10-05 03:21:03.761492,2023-10-05 03:45:01.944600,0 days 00:23:58.183108,55,xavier,3,1.3840372924128387e-05,0.0002436535934717878,1,COMPLETE
57,57,0.7605865240097046,0.25,2023-10-05 03:45:01.947990,2023-10-05 04:11:20.951486,0 days 00:26:19.003496,60,xavier,5,1.3759676014151267e-05,0.0007921782749878397,1,COMPLETE
58,58,1.3278710819780826,0.3,2023-10-05 04:11:20.954010,2023-10-05 04:20:04.829899,0 days 00:08:43.875889,20,kaiming,5,0.00018194679089302034,0.001671006174957121,1,COMPLETE
59,59,5.653532171274401,0.5094047619047619,2023-10-05 04:20:04.837781,2023-10-05 04:27:37.543250,0 days 00:07:32.705469,20,kaiming,3,0.0003342944801380899,0.0028625480948500513,1,COMPLETE
60,60,5.201800254566626,0.4916666666666667,2023-10-05 04:27:37.546133,2023-10-05 04:52:59.749312,0 days 00:25:22.203179,60,kaiming,2,0.0001764773482334698,0.00015465682561471234,1,COMPLETE
61,61,0.8741607863456011,0.6833333333333333,2023-10-05 04:52:59.756725,2023-10-05 05:10:07.074855,0 days 00:17:07.318130,40,kaiming,5,2.9031746159753427e-05,0.00034787918884659504,1,COMPLETE
62,62,0.7535297889262438,0.3,2023-10-05 05:10:07.079914,2023-10-05 05:22:24.002001,0 days 00:12:16.922087,30,xavier,5,6.549806015316304e-05,0.0005309161885858447,1,COMPLETE
63,63,1.4182019703090192,0.21666666666666665,2023-10-05 05:22:24.005074,2023-10-05 05:24:30.876481,0 days 00:02:06.871407,5,xavier,5,8.278590129938037e-05,0.00048511658243463097,1,COMPLETE
64,64,0.860074972388921,0.5119449831214538,2023-10-05 05:24:30.879223,2023-10-05 05:31:16.596347,0 days 00:06:45.717124,15,xavier,2,1.7165994995213587e-05,0.00048511658243463097,1,COMPLETE
65,65,0.9727875626611489,0.46075757575757575,2023-10-05 05:31:16.599102,2023-10-05 05:41:31.495919,0 days 00:10:14.896817,25,xavier,2,2.4754932835120276e-05,0.0003080938019287428,1,COMPLETE
66,66,1.7657625214196742,0.5333333333333333,2023-10-05 05:41:31.505494,2023-10-05 05:58:59.629460,0 days 00:17:28.123966,40,kaiming,5,7.756983343103515e-05,0.0001518929960483665,1,COMPLETE
67,67,6.054387629497365,0.5,2023-10-05 05:58:59.631860,2023-10-05 06:22:51.618340,0 days 00:23:51.986480,55,kaiming,2,0.0005618628079159029,0.0005062069485405821,1,COMPLETE
68,68,8.058643484130608,0.525,2023-10-05 06:22:51.622410,2023-10-05 06:46:42.627884,0 days 00:23:51.005474,55,xavier,5,0.0005431502206389211,0.00036416936499233997,1,COMPLETE
69,69,0.9003060325980187,0.5,2023-10-05 06:46:42.636347,2023-10-05 07:06:09.363878,0 days 00:19:26.727531,45,kaiming,5,1.7165994995213587e-05,0.0030343061368623236,1,COMPLETE
70,70,0.8050085262528489,0.5066666666666666,2023-10-05 07:06:09.366997,2023-10-05 07:15:30.075593,0 days 00:09:20.708596,25,xavier,4,2.3908207388030162e-05,0.0003080938019287428,1,COMPLETE
71,71,0.9173487206920982,0.7666666666666666,2023-10-05 07:15:30.080895,2023-10-05 07:22:02.420491,0 days 00:06:32.339596,15,xavier,5,8.62253171693055e-05,0.00013725342542279201,1,COMPLETE
72,72,1.3308203966265346,0.3358843537414966,2023-10-05 07:22:02.424827,2023-10-05 07:30:24.729344,0 days 00:08:22.304517,20,xavier,3,7.756983343103515e-05,0.0017055418029547835,1,COMPLETE
73,73,3.24504483391272,0.564700650226966,2023-10-05 07:30:24.731897,2023-10-05 07:55:58.043313,0 days 00:25:33.311416,60,kaiming,2,5.490779643815036e-05,0.0015401474318360504,1,COMPLETE
74,74,0.8235675187660727,0.5622387742975978,2023-10-05 07:55:58.051802,2023-10-05 08:08:49.377270,0 days 00:12:51.325468,30,xavier,2,1.1935401995024835e-05,0.00036416936499233997,1,COMPLETE
75,75,1.8961947329697204,0.5061891195224529,2023-10-05 08:08:49.380935,2023-10-05 08:10:54.744475,0 days 00:02:05.363540,5,xavier,2,0.00018999824252825717,0.0005309161885858447,1,COMPLETE
76,76,0.8347307406365871,0.6166666666666666,2023-10-05 08:10:54.747482,2023-10-05 08:30:55.328623,0 days 00:20:00.581141,45,xavier,5,4.887138695816922e-05,0.0005727605686497398,1,COMPLETE
77,77,5.921515004886663,0.43666666666666665,2023-10-05 08:30:55.333265,2023-10-05 08:36:52.224558,0 days 00:05:56.891293,15,kaiming,4,0.00037440644834010737,0.0006272761746264421,1,COMPLETE
78,78,3.6093340506366074,0.5,2023-10-05 08:36:52.230548,2023-10-05 08:49:51.968688,0 days 00:12:59.738140,30,xavier,5,0.00015141969357094926,0.00036416936499233997,1,COMPLETE
79,79,0.679805839913232,0.6102437641723356,2023-10-05 08:49:51.972216,2023-10-05 08:57:57.979822,0 days 00:08:06.007606,20,kaiming,3,1.630310812977364e-05,0.0029438243879293126,1,COMPLETE
80,80,5.031198339137228,0.5,2023-10-05 08:57:57.982602,2023-10-05 09:06:48.880480,0 days 00:08:50.897878,20,kaiming,2,0.0005225458073791873,0.0001245713624255069,1,COMPLETE
81,81,4.1199865931475195,0.5568009768009768,2023-10-05 09:06:48.883929,2023-10-05 09:13:07.280766,0 days 00:06:18.396837,15,xavier,2,0.00012091776276713376,0.005015065210699529,1,COMPLETE
82,82,0.9231920924037695,0.5833333333333333,2023-10-05 09:13:07.284044,2023-10-05 09:24:15.867388,0 days 00:11:08.583344,25,kaiming,5,1.1742386920351268e-05,0.00031548643574718873,1,COMPLETE
83,83,1.1349769356607189,0.5209157509157509,2023-10-05 09:24:15.870698,2023-10-05 09:41:55.043442,0 days 00:17:39.172744,40,kaiming,2,1.7165994995213587e-05,0.0030343061368623236,1,COMPLETE
84,84,1.445872906781733,0.11666666666666665,2023-10-05 09:41:55.046577,2023-10-05 09:44:03.475145,0 days 00:02:08.428568,5,xavier,5,2.9031746159753427e-05,0.0009807645517068144,1,COMPLETE
85,85,1.1276576418429614,0.7,2023-10-05 09:44:03.477748,2023-10-05 09:56:42.109356,0 days 00:12:38.631608,30,kaiming,5,2.3908207388030162e-05,0.0005309161885858447,1,COMPLETE
86,86,0.9239517243845121,0.5,2023-10-05 09:56:42.118520,2023-10-05 10:00:37.782038,0 days 00:03:55.663518,10,kaiming,4,1.0806277773722783e-05,0.00028009181772767046,1,COMPLETE
87,87,0.7461112916469574,0.5666666666666667,2023-10-05 10:00:37.784264,2023-10-05 10:20:23.806648,0 days 00:19:46.022384,45,xavier,5,1.1935401995024835e-05,0.00036416936499233997,1,COMPLETE
88,88,5.591573293007761,0.4666666666666667,2023-10-05 10:20:23.816183,2023-10-05 10:37:53.884130,0 days 00:17:30.067947,45,kaiming,4,0.0003078905904798025,0.00034081964885732173,1,COMPLETE
89,89,2.3014567495994016,0.6166666666666667,2023-10-05 10:37:53.888345,2023-10-05 10:47:02.574335,0 days 00:09:08.685990,20,xavier,5,0.00045166579056825,0.003385092252430027,1,COMPLETE
90,90,5.516378608833885,0.545959595959596,2023-10-05 10:47:02.577025,2023-10-05 10:58:08.412963,0 days 00:11:05.835938,25,kaiming,2,0.00017908195110697078,0.00034787918884659504,1,COMPLETE
91,91,5.262455940273736,0.5142857142857142,2023-10-05 10:58:08.416546,2023-10-05 11:06:18.394063,0 days 00:08:09.977517,20,xavier,3,0.0005755204654760927,0.005266968216743098,1,COMPLETE
92,92,0.7267699986696242,0.5894269619269619,2023-10-05 11:06:18.396767,2023-10-05 11:10:43.318051,0 days 00:04:24.921284,10,kaiming,2,1.0806277773722783e-05,0.000555262574539825,1,COMPLETE
93,93,0.939945832320622,0.5233333333333333,2023-10-05 11:10:43.321034,2023-10-05 11:16:50.203510,0 days 00:06:06.882476,15,xavier,4,2.4754932835120276e-05,0.0003080938019287428,1,COMPLETE
94,94,0.9150796312306608,0.4533333333333333,2023-10-05 11:16:50.214430,2023-10-05 11:41:08.538386,0 days 00:24:18.323956,55,xavier,4,2.4754932835120276e-05,0.0002266682480824686,1,COMPLETE
95,95,2.457895854895469,0.4766666666666667,2023-10-05 11:41:08.542316,2023-10-05 11:48:08.987324,0 days 00:07:00.445008,15,kaiming,4,0.00015141969357094926,0.00024588196761306773,1,COMPLETE
96,96,1.0987851920404605,0.41083333333333333,2023-10-05 11:48:08.990440,2023-10-05 11:50:33.280927,0 days 00:02:24.290487,5,xavier,3,8.278590129938037e-05,0.007164970177154133,1,COMPLETE
97,97,0.7807064818484443,0.5833333333333334,2023-10-05 11:50:33.284451,2023-10-05 12:02:25.385333,0 days 00:11:52.100882,25,xavier,4,2.4925198299231286e-05,0.003598061691559879,1,COMPLETE
98,98,0.8841902494430542,0.6499999999999999,2023-10-05 12:02:25.388961,2023-10-05 12:26:42.669897,0 days 00:24:17.280936,45,kaiming,5,2.8634365302011944e-05,0.00013725342542279201,1,COMPLETE
99,99,2.5914574496107634,0.399155328798186,2023-10-05 12:26:42.675961,2023-10-05 12:56:42.313052,0 days 00:29:59.637091,60,xavier,3,7.563678909592054e-05,0.003370929974199209,1,COMPLETE
